{
  "$schema": "https://json-schema.org/draft/2020-12/schema",
  "$id": "https://claw-runtime.local/openclaw.runtime-secrets.schema.json",
  "title": "OpenClaw Runtime Secrets Payload",
  "type": "object",
  "additionalProperties": false,
  "properties": {
    "auth": {
      "type": "object",
      "description": "Sensitive OpenClaw provider or integration authentication config merged into the runtime config. For local Docker, api_key profiles may also carry a raw apiKey value that is written to Docker env bootstrap output and stripped from the rendered OpenClaw config."
    },
    "channels": {
      "type": "object",
      "description": "Sensitive channel configuration such as bot tokens merged into the runtime config."
    },
    "hooks": {
      "type": "object",
      "description": "Hook configuration and any hook-scoped secret values merged into runtime hooks."
    },
    "gateway": {
      "type": "object",
      "additionalProperties": false,
      "properties": {
        "auth": {
          "type": "object",
          "description": "Sensitive gateway authentication config merged into gateway.auth."
        }
      },
      "required": [
        "auth"
      ]
    },
    "gog": {
      "type": "object",
      "description": "Local Docker helper secrets for gog integration bootstrap. Set gog.account as the workflow account source of truth, and provide the matching service-account material under gog.serviceAccounts. This branch is rendered into separate Docker bootstrap artifacts and must not appear in rendered OpenClaw config."
    }
  },
  "required": [
    "auth",
    "gateway"
  ]
}
