{
  "$schema": "./openclaw.runtime-secrets.schema.json",
  "auth": {
    "profiles": {
      "openrouter:default": {
        "provider": "openrouter",
        "mode": "api_key",
        "apiKey": "REPLACE_ME_OPENROUTER_API_KEY"
      }
    }
  },
  "gateway": {
    "auth": {
      "mode": "token",
      "token": "REPLACE_ME"
    }
  },
  "channels": {
    "telegram": {
      "enabled": false,
      "botToken": "REPLACE_WITH_A_TELEGRAM_BOT_TOKEN_IF_ENABLING_TELEGRAM"
    }
  },
  "gog": {
    "account": "gmail-workflow@example.com",
    "serviceAccounts": {
      "gmail-workflow@example.com": {
        "type": "service_account",
        "project_id": "REPLACE_ME",
        "private_key_id": "REPLACE_ME",
        "private_key": "-----BEGIN PRIVATE KEY-----\\nREPLACE_ME\\n-----END PRIVATE KEY-----\\n",
        "client_email": "REPLACE_ME@REPLACE_ME.iam.gserviceaccount.com",
        "client_id": "REPLACE_ME",
        "token_uri": "https://oauth2.googleapis.com/token"
      }
    }
  },
  "hooks": {
    "enabled": false,
    "path": "/hooks",
    "token": "REPLACE_ME_IF_ENABLING_GMAIL_HOOKS",
    "presets": [],
    "gmail": {
      "label": "INBOX",
      "topic": "projects/REPLACE_PROJECT/topics/REPLACE_TOPIC",
      "subscription": "REPLACE_SUBSCRIPTION",
      "pushToken": "REPLACE_GMAIL_PUSH_TOKEN",
      "hookUrl": "http://127.0.0.1:18789/hooks/gmail",
      "includeBody": true,
      "maxBytes": 20000,
      "renewEveryMinutes": 720,
      "serve": {
        "bind": "127.0.0.1",
        "port": 8788,
        "path": "/"
      },
      "tailscale": {
        "mode": "off",
        "path": "/gmail-pubsub"
      }
    }
  }
}
